630,Red Lake Falls Public School District,370,39,10.54%,43,11.62%,Red Lake Falls Public School District,2180,244,30450
38,Red Lake Public School District,1497,1497,100.00%,301,20.11%,Red Lake Public School District,5859,1950,30510
2884,Red Rock Central School District,458,34,7.42%,66,14.41%,Red Rock Central School District,3176,334,00132
256,Red Wing Public School District,2667,649,24.33%,462,17.32%,Red Wing Public School District,19060,2347,30480
2897,Redwood Area School District,1137,409,35.97%,237,20.84%,Redwood Area School District,7988,903,00182
2890,Renville County West School District,588,214,36.39%,106,18.03%,Renville County West School District,4318,377,00163
280,Richfield Public School District,4319,3081,71.34%,709,16.42%,Richfield Public School District,41311,3828,31750
281,Robbinsdale Public School District,12546,7643,60.92%,1827,14.56%,Robbinsdale Public School District,103294,10476,31780
535,Rochester Public School District,18015,7350,40.80%,3098,17.20%,Rochester Public School District,127003,12067,31800
883,Rockford Public School District,1634,301,18.42%,211,12.91%,Rockford Public School District,10067,634,32070
750,ROCORI Public School District,2135,292,13.68%,252,11.80%,ROCORI Public School District,13312,898,09440
682,Roseau Public School District,1183,74,6.26%,179,15.13%,Roseau Public School District,6615,471,32250
196,Rosemount-Apple Valley-Eagan,28997,10817,37.30%,4463,15.39%,Rosemount-Apple Valley-Eagan,152507,8207,32390
623,Roseville Public School District,7655,4313,56.34%,1087,14.20%,Roseville Public School District,57325,6070,32430
850,Rothsay Public School District,304,22,7.24%,38,12.50%,Rothsay Public School District,1065,54,32460
485,Royalton Public School District,954,62,6.50%,147,15.41%,Royalton Public School District,3811,385,32520
2902,RTR Public Schools,589,36,6.11%,63,10.70%,RTR Public Schools,3646,389,00294
139,Rush City Public School District,848,78,9.20%,103,12.15%,Rush City Public School District,6396,515,32550
239,Rushford-Peterson Public Schools,697,38,5.45%,74,10.62%,Rushford-Peterson Public Schools,4033,342,28290
748,Sartell-St. Stephen School District,4074,376,9.23%,653,16.03%,Sartell-St. Stephen School District,18415,474,32820
743,Sauk Centre Public School District,1098,120,10.93%,186,16.94%,Sauk Centre Public School District,7748,713,32850
47,Sauk Rapids-Rice Public Schools,4647,638,13.73%,863,18.57%,Sauk Rapids-Rice Public Schools,23850,2944,32880
820,Sebeka Public School District,496,30,6.05%,102,20.56%,Sebeka Public School District,2972,407,32970
720,Shakopee Public School District,8319,3542,42.58%,1292,15.53%,Shakopee Public School District,46001,2776,33000
2310,Sibley East School District,1150,418,36.35%,188,16.35%,Sibley East School District,7419,516,00102
84,Sleepy Eye Public School District,609,231,37.93%,87,14.29%,Sleepy Eye Public School District,5348,540,33210
363,South Koochiching School District,287,51,17.77%,61,21.25%,South Koochiching School District,1328,169,32700
6,South St. Paul Public School District,3548,1618,45.60%,571,16.09%,South St. Paul Public School District,19955,2160,33270
833,South Washington County School District,18966,6296,33.20%,2940,15.50%,South Washington County School District,98542,3960,33810
500,Southland Public School District,382,33,8.64%,50,13.09%,Southland Public School District,3503,308,02720
297,Spring Grove School District,361,12,3.32%,50,13.85%,Spring Grove School District,2109,199,33300
16,Spring Lake Park Public Schools,6096,2661,43.65%,788,12.93%,Spring Lake Park Public Schools,32255,2336,33330
85,Springfield Public School District,566,45,7.95%,70,12.37%,Springfield Public School District,3154,210,33390
282,St. Anthony-New Brighton Schools,1837,633,34.46%,164,8.93%,St. Anthony-New Brighton Schools,11166,574,33420
858,St. Charles Public School District,996,191,19.18%,103,10.34%,St. Charles Public School District,6100,496,33450
75,St. Clair Public School District,666,18,2.70%,85,12.76%,St. Clair Public School District,2638,141,33480
742,St. Cloud Public School District,10292,5629,54.69%,2078,20.19%,St. Cloud Public School District,100759,18489,33510
15,St. Francis Public School District,4547,673,14.80%,717,15.77%,St. Francis Public School District,32369,1507,33540
840,St. James Public School District,1042,544,52.21%,179,17.18%,St. James Public School District,6201,736,33600
2142,St. Louis County School District,2061,428,20.77%,441,21.40%,St. Louis County School District,17531,1784,00008
283,St. Louis Park Public School District,4714,2152,45.65%,655,13.89%,St. Louis Park Public School District,46738,3462,33780
885,St. Michael-Albertville School District,6463,852,13.18%,677,10.48%,St. Michael-Albertville School District,24081,225,33790
625,St. Paul Public School District,36888,29207,79.18%,5791,15.70%,St. Paul Public School District,302760,58763,33840
508,St. Peter Public School District,2246,664,29.56%,404,17.99%,St. Peter Public School District,15389,1813,33870
2170,Staples-Motley School District,1104,130,11.78%,227,20.56%,Staples-Motley School District,9616,1302,33900
2856,Stephen-Argyle Central Schools,300,37,12.33%,35,11.67%,Stephen-Argyle Central Schools,1933,99,00127
534,Stewartville Public School District,2108,153,7.26%,326,15.46%,Stewartville Public School District,9252,802,38160
834,Stillwater Area Public School District,8554,1631,19.07%,1309,15.30%,Stillwater Area Public School District,65062,2906,38190
486,Swanville Public School District,329,18,5.47%,43,13.07%,Swanville Public School District,1744,135,38280
564,Thief River Falls School District,2020,341,16.88%,388,19.21%,Thief River Falls School District,13736,1283,38850
2904,Tracy Area Public School District,732,165,22.54%,115,15.71%,Tracy Area Public School District,5239,534,00326
2905,Tri-City United School District,1899,414,21.80%,335,17.64%,Tri-City United School District,12618,1274,00379
2358,Tri-County School District,200,7,3.50%,36,18.00%,Tri-County School District,1969,258,91446
2125,Triton School District,1075,246,22.88%,195,18.14%,Triton School District,7140,666,40665
458,Truman Public School District,216,18,8.33%,36,16.67%,Truman Public School District,2247,265,40680
914,Ulen-Hitterdal Public School District,303,61,20.13%,45,14.85%,Ulen-Hitterdal Public School District,1731,99,40810
550,Underwood Public School District,567,36,6.35%,67,11.82%,Underwood Public School District,2492,241,40830
2134,United South Central School District,737,144,19.54%,117,15.88%,United South Central School District,5782,754,00005
487,Upsala Public School District,380,16,4.21%,51,13.42%,Upsala Public School District,2031,185,40860
818,Verndale Public School District,573,43,7.50%,120,20.94%,Verndale Public School District,1678,222,40920
706,Virginia Public School District,1765,293,16.60%,265,15.01%,Virginia Public School District,10781,2163,41040
811,Wabasha-Kellogg Public School District,515,52,10.10%,75,14.56%,Wabasha-Kellogg Public School District,5122,357,41060
640,Wabasso Public School District,407,17,4.18%,64,15.72%,Wabasso Public School District,2489,160,41430
110,Waconia Public School District,4123,415,10.07%,618,14.99%,Waconia Public School District,21275,688,41460
2155,Wadena-Deer Creek School District,1040,108,10.38%,215,20.67%,Wadena-Deer Creek School District,7936,1337,00022
113,Walker-Hackensack-Akeley School District,799,269,33.67%,189,23.65%,Walker-Hackensack-Akeley School District,7258,950,02910
2176,Warren-Alvarado-Oslo School District,526,97,18.44%,96,18.25%,Warren-Alvarado-Oslo School District,3744,363,00024
690,Warroad Public School District,1002,263,26.25%,168,16.77%,Warroad Public School District,5970,695,41850
829,Waseca Public School District,1945,401,20.62%,351,18.05%,Waseca Public School District,12032,1072,41880
111,Watertown-Mayer Public School District,1552,89,5.73%,267,17.20%,Watertown-Mayer Public School District,9833,526,41910
2143,Waterville-Elysian-Morristown Public School District,791,100,12.64%,159,20.10%,Waterville-Elysian-Morristown Public School District,6728,422,00013
435,Waubun-Ogema-White Earth Public Schools,697,563,80.77%,106,15.21%,Waubun-Ogema-White Earth Public Schools,3305,685,42120
284,Wayzata Public School District,11948,4470,37.41%,1078,9.02%,Wayzata Public School District,69279,2780,42160
2342,West Central Area,786,62,7.89%,137,17.43%,West Central Area,5023,430,00104
197,West St. Paul-Mendota Heights-Eagan,5222,2591,49.62%,990,18.96%,West St. Paul-Mendota Heights-Eagan,43260,4139,42270
2898,Westbrook-Walnut Grove Schools,364,100,27.47%,66,18.13%,Westbrook-Walnut Grove Schools,2788,450,00183
277,Westonka Public School District,2447,335,13.69%,424,17.33%,Westonka Public School District,19154,776,22920
803,Wheaton Area Public School District,392,68,17.35%,67,17.09%,Wheaton Area Public School District,2140,243,42330
624,White Bear Lake School District,8860,2396,27.04%,1483,16.74%,White Bear Lake School District,65782,3055,42360
347,Willmar Public School District,4478,2688,60.03%,604,13.49%,Willmar Public School District,25711,3312,42720
577,Willow River Public School District,415,20,4.82%,72,17.35%,Willow River Public School District,3434,412,42750
177,Windom Public School District,1064,313,29.42%,202,18.98%,Windom Public School District,6115,791,42780
2609,Win-E-Mac School District,487,28,5.75%,67,13.76%,Win-E-Mac School District,3315,340,91449
861,Winona Area Public School District,2937,593,20.19%,656,22.34%,Winona Area Public School District,39562,5831,44070
518,Worthington Public School District,3904,2569,65.80%,522,13.37%,Worthington Public School District,16278,2599,44160
100,Wrenshall Public School District,377,35,9.28%,70,18.57%,Wrenshall Public School District,1872,140,44190
2190,Yellow Medicine East,696,214,30.75%,155,22.27%,Yellow Medicine East,6610,955,00099
2805,Zumbrota-Mazeppa School District,1204,88,7.31%,182,15.12%,Zumbrota-Mazeppa School District,7172,450,45735
